{
  "id": "novachat.openai",
  "name": "OpenAI Provider",
  "description": "OpenAI Provider",
  "version": "0.1.1",
  "author": "NovaChat",
  "configuration": {
    "title": "OpenAI",
    "properties": {
      "openai.apiKey": {
        "type": "string",
        "description": "OpenAI API key",
        "default": "",
        "format": "password"
      }
    }
  }
}
