{
  "id": "novachat.translator",
  "name": "Translator",
  "description": "Translate text",
  "version": "0.1.0",
  "author": "NovaChat",
  "configuration": {
    "title": "Translator",
    "properties": {
      "translator.localLanguage": {
        "type": "string",
        "description": "Local language",
        "default": "eng",
        "enum": [
          "cmn",
          "spa",
          "eng",
          "rus",
          "arb",
          "ben",
          "hin",
          "por",
          "ind",
          "jpn",
          "fra",
          "deu",
          "jav",
          "jav",
          "kor",
          "tel",
          "vie",
          "mar",
          "ita",
          "tam",
          "tur",
          "urd",
          "guj",
          "pol",
          "ukr",
          "kan",
          "mai",
          "mal",
          "pes",
          "mya",
          "swh",
          "sun",
          "ron",
          "pan",
          "bho",
          "amh",
          "hau",
          "fuv",
          "bos",
          "bos",
          "hrv",
          "nld",
          "srp",
          "srp",
          "tha",
          "ckb",
          "yor",
          "uzn",
          "uzn",
          "zlm",
          "zlm",
          "ibo",
          "npi",
          "ceb",
          "skr",
          "tgl",
          "hun",
          "azj",
          "azj",
          "sin",
          "koi",
          "ell",
          "ces",
          "mag",
          "run",
          "bel",
          "plt",
          "qug",
          "mad",
          "nya",
          "zyb",
          "pbu",
          "kin",
          "zul",
          "bul",
          "swe",
          "lin",
          "som",
          "hms",
          "hnj",
          "ilo",
          "kaz"
        ],
        "enumDescriptions": [
          "Mandarin Chinese",
          "Spanish",
          "English",
          "Russian",
          "Standard Arabic",
          "Bengali",
          "Hindi",
          "Portuguese",
          "Indonesian",
          "Japanese",
          "French",
          "German",
          "Javanese (Javanese)",
          "Javanese (Latin)",
          "Korean",
          "Telugu",
          "Vietnamese",
          "Marathi",
          "Italian",
          "Tamil",
          "Turkish",
          "Urdu",
          "Gujarati",
          "Polish",
          "Ukrainian",
          "Kannada",
          "Maithili",
          "Malayalam",
          "Iranian Persian",
          "Burmese",
          "Swahili (individual language)",
          "Sundanese",
          "Romanian",
          "Panjabi",
          "Bhojpuri",
          "Amharic",
          "Hausa",
          "Nigerian Fulfulde",
          "Bosnian (Cyrillic)",
          "Bosnian (Latin)",
          "Croatian",
          "Dutch",
          "Serbian (Cyrillic)",
          "Serbian (Latin)",
          "Thai",
          "Central Kurdish",
          "Yoruba",
          "Northern Uzbek (Cyrillic)",
          "Northern Uzbek (Latin)",
          "Malay (individual language) (Arabic)",
          "Malay (individual language) (Latin)",
          "Igbo",
          "Nepali (individual language)",
          "Cebuano",
          "Saraiki",
          "Tagalog",
          "Hungarian",
          "North Azerbaijani (Cyrillic)",
          "North Azerbaijani (Latin)",
          "Sinhala",
          "Komi-Permyak",
          "Modern Greek (1453-)",
          "Czech",
          "Magahi",
          "Rundi",
          "Belarusian",
          "Plateau Malagasy",
          "Chimborazo Highland Quichua",
          "Madurese",
          "Nyanja",
          "Yongbei Zhuang",
          "Northern Pashto",
          "Kinyarwanda",
          "Zulu",
          "Bulgarian",
          "Swedish",
          "Lingala",
          "Somali",
          "Southern Qiandong Miao",
          "Hmong Njua",
          "Iloko",
          "Kazakh"
        ]
      }
    }
  }
}
