{
  "id": "novachat.translator",
  "name": "Translator",
  "description": "Translate text",
  "version": "0.1.0",
  "author": "NovaChat",
  "configuration": {
    "title": "Translator",
    "properties": {
      "translator.localLanguage": {
        "type": "string",
        "description": "Local language",
        "default": "eng",
        "enum": [
          "cmn",
          "spa",
          "eng",
          "rus",
          "arb",
          "ben",
          "hin",
          "por",
          "ind",
          "jpn",
          "fra",
          "deu",
          "jav",
          "jav",
          "kor",
          "tel",
          "vie",
          "mar",
          "ita",
          "tam",
          "tur",
          "urd",
          "guj",
          "pol",
          "ukr",
          "kan",
          "mai",
          "mal",
          "pes",
          "mya",
          "swh",
          "sun",
          "ron",
          "pan",
          "bho",
          "amh",
          "hau",
          "fuv",
          "bos",
          "bos",
          "hrv",
          "nld",
          "srp",
          "srp",
          "tha",
          "ckb",
          "yor",
          "uzn",
          "uzn",
          "zlm",
          "zlm",
          "ibo",
          "npi",
          "ceb",
          "skr",
          "tgl",
          "hun",
          "azj",
          "azj",
          "sin",
          "koi",
          "ell",
          "ces",
          "mag",
          "run",
          "bel",
          "plt",
          "qug",
          "mad",
          "nya",
          "zyb",
          "pbu",
          "kin",
          "zul",
          "bul",
          "swe",
          "lin",
          "som",
          "hms",
          "hnj",
          "ilo",
          "kaz"
        ],
        "enumDescriptions": [
          "简体中文",
          "Español",
          "English",
          "Русский",
          "العربية الفصحى",
          "বাংলা",
          "हिन्दी",
          "Português",
          "Bahasa Indonesia",
          "日本語",
          "Français",
          "Deutsch",
          "ꦧꦱꦗꦮ",
          "Basa Jawa",
          "한국어",
          "తెలుగు",
          "Tiếng Việt",
          "मराठी",
          "Italiano",
          "தமிழ்",
          "Türkçe",
          "اردو",
          "ગુજરાતી",
          "Polski",
          "Українська",
          "ಕನ್ನಡ",
          "मैथिली",
          "മലയാളം",
          "فارسی",
          "မြန်မာဘာသာ",
          "Kiswahili",
          "Basa Sunda",
          "Română",
          "ਪੰਜਾਬੀ",
          "भोजपुरी",
          "አማርኛ",
          "Hausa",
          "Fulfulde",
          "Босански",
          "Bosanski",
          "Hrvatski",
          "Nederlands",
          "Српски",
          "Srpski",
          "ไทย",
          "کوردیی ناوەندی",
          "Yorùbá",
          "Ўзбек",
          "O'zbek",
          "بهاس ملايو",
          "Bahasa Melayu",
          "Igbo",
          "नेपाली",
          "Cebuano",
          "سرائیکی",
          "Tagalog",
          "Magyar",
          "Азәрбајҹан",
          "Azərbaycan",
          "සිංහල",
          "Коми-Пермяцкӧй",
          "Ελληνικά",
          "Čeština",
          "मगही",
          "Ikirundi",
          "Беларуская",
          "Malagasy",
          "Kichwa",
          "Madhura",
          "Chichewa",
          "Vahcuengh",
          "پښتو",
          "Kinyarwanda",
          "isiZulu",
          "Български",
          "Svenska",
          "Lingála",
          "Soomaali",
          "Hmong Daw",
          "Hmoob Njua",
          "Ilokano",
          "Қазақ"
        ]
      },
      "translator.systemPrompt": {
        "type": "string",
        "description": "System prompt",
        "default": "You are a professional, authentic machine translation engine. Translate the following source text to {{to}}, Output translation directly without any additional text.",
        "format": "markdown"
      },
      "translator.model": {
        "type": "string",
        "description": "Model",
        "format": "model"
      }
    }
  }
}
